-- ONE PER QUEUE FIFO TESTS ONLY
-- This test file validates the read head message per FIFO queue implementation
-- Stabilize output and ensure clean extension state
SET client_min_messages = warning;
DROP EXTENSION IF EXISTS pgmq CASCADE;
CREATE EXTENSION pgmq;
-- Setup test environment
SELECT pgmq.create('fifo_test_queue');
 create 
--------
 
(1 row)

-- Create multiple groups with different message counts
SELECT * FROM pgmq.send('fifo_test_queue', '{"group": "A", "message": 1}'::jsonb, '{"x-pgmq-group": "group_A"}'::jsonb);
 send 
------
    1
(1 row)

SELECT * FROM pgmq.send('fifo_test_queue', '{"group": "A", "message": 2}'::jsonb, '{"x-pgmq-group": "group_A"}'::jsonb);
 send 
------
    2
(1 row)

SELECT * FROM pgmq.send('fifo_test_queue', '{"group": "A", "message": 3}'::jsonb, '{"x-pgmq-group": "group_A"}'::jsonb);
 send 
------
    3
(1 row)

SELECT * FROM pgmq.send('fifo_test_queue', '{"group": "B", "message": 1}'::jsonb, '{"x-pgmq-group": "group_B"}'::jsonb);
 send 
------
    4
(1 row)

SELECT * FROM pgmq.send('fifo_test_queue', '{"group": "B", "message": 2}'::jsonb, '{"x-pgmq-group": "group_B"}'::jsonb);
 send 
------
    5
(1 row)

SELECT * FROM pgmq.send('fifo_test_queue', '{"group": "C", "message": 1}'::jsonb, '{"x-pgmq-group": "group_C"}'::jsonb);
 send 
------
    6
(1 row)

-- Verify we have 6 messages in queue
SELECT COUNT(*) = 6 FROM pgmq.q_fifo_test_queue;
 ?column? 
----------
 t
(1 row)

-- Request 3 messages - should get only 1st message of each group (only 3 groups)
SELECT COUNT(*) = 3 FROM pgmq.read_grouped_head('fifo_test_queue', 10, 4);
 ?column? 
----------
 t
(1 row)

-- reset visibility
UPDATE pgmq.q_fifo_test_queue SET vt = clock_timestamp() - interval '1 second';
-- Verify the messages are from groups A, B, C in correct order
SELECT ARRAY(
    SELECT (message->>'group')::text FROM pgmq.read_grouped_head('fifo_test_queue', 10, 4) ORDER BY msg_id
) = ARRAY['A', 'B', 'C']::text[];
 ?column? 
----------
 t
(1 row)

-- reset visibility
UPDATE pgmq.q_fifo_test_queue SET vt = clock_timestamp() - interval '1 second';
-- Verify first read of 2 messages returns g1-msg1 and g2-msg1, second read returns g3-msg1 and third read returns nothing
-- first read
SELECT ARRAY(
    SELECT CONCAT((message->>'group')::text, '-', message->>'message'::text) FROM pgmq.read_grouped_head('fifo_test_queue', 10, 2)
) = ARRAY['A-1', 'B-1']::text[];
 ?column? 
----------
 t
(1 row)

-- second read
SELECT ARRAY(
    SELECT CONCAT((message->>'group')::text, '-', message->>'message'::text) FROM pgmq.read_grouped_head('fifo_test_queue', 10, 2)
) = ARRAY['C-1']::text[];
 ?column? 
----------
 t
(1 row)

-- third read
SELECT ARRAY(
    SELECT CONCAT((message->>'group')::text, '-', message->>'message'::text) FROM pgmq.read_grouped_head('fifo_test_queue', 10, 2)
) = ARRAY[]::text[];
 ?column? 
----------
 t
(1 row)

-- Clean up for next test
SELECT * FROM pgmq.purge_queue('fifo_test_queue');
 purge_queue 
-------------
           6
(1 row)

-- Create message with default group
SELECT * FROM pgmq.send('fifo_test_queue', '{"group": "A", "message": 1}'::jsonb, '{"x-pgmq-group": "group_A"}'::jsonb);
 send 
------
    7
(1 row)

SELECT * FROM pgmq.send('fifo_test_queue', '{"group": "B", "message": 1}'::jsonb, '{"x-pgmq-group": "group_B"}'::jsonb);
 send 
------
    8
(1 row)

SELECT * FROM pgmq.send('fifo_test_queue', '{"group": "A", "message": 2}'::jsonb, '{"x-pgmq-group": "group_A"}'::jsonb);
 send 
------
    9
(1 row)

SELECT * FROM pgmq.send('fifo_test_queue', '{"group": "default", "message": 1}'::jsonb);
 send 
------
   10
(1 row)

-- Verify read in default group
SELECT ARRAY(
    SELECT CONCAT((message->>'group')::text, '-', message->>'message'::text) FROM pgmq.read_grouped_head('fifo_test_queue', 10, 4)
) = ARRAY['A-1', 'B-1', 'default-1']::text[];
 ?column? 
----------
 t
(1 row)

-- Clean up for next test
SELECT * FROM pgmq.purge_queue('fifo_test_queue');
 purge_queue 
-------------
           4
(1 row)

-- Test read_grouped_head_with_poll
SELECT pgmq.create('fifo_head_poll_queue');
 create 
--------
 
(1 row)

-- Insert messages across 3 groups
SELECT * FROM pgmq.send('fifo_head_poll_queue', '{"n":1}'::jsonb, '{"x-pgmq-group":"g1"}'::jsonb);
 send 
------
    1
(1 row)

SELECT * FROM pgmq.send('fifo_head_poll_queue', '{"n":1}'::jsonb, '{"x-pgmq-group":"g2"}'::jsonb);
 send 
------
    2
(1 row)

SELECT * FROM pgmq.send('fifo_head_poll_queue', '{"n":1}'::jsonb, '{"x-pgmq-group":"g3"}'::jsonb);
 send 
------
    3
(1 row)

SELECT * FROM pgmq.send('fifo_head_poll_queue', '{"n":2}'::jsonb, '{"x-pgmq-group":"g1"}'::jsonb);
 send 
------
    4
(1 row)

SELECT * FROM pgmq.send('fifo_head_poll_queue', '{"n":2}'::jsonb, '{"x-pgmq-group":"g2"}'::jsonb);
 send 
------
    5
(1 row)

-- Validate polling returns exactly one message per group (heads only)
WITH results AS (
    SELECT * FROM pgmq.read_grouped_head_with_poll('fifo_head_poll_queue', 10, 5, 1, 100)
)
SELECT
    (SELECT COUNT(*) FROM results) = 3 as count_correct,
    (SELECT ARRAY_AGG(headers->>'x-pgmq-group' ORDER BY msg_id) FROM results)
        = ARRAY['g1','g2','g3']::text[] as correct_groups,
    (SELECT ARRAY_AGG((message->>'n')::int ORDER BY msg_id) FROM results)
        = ARRAY[1,1,1]::int[] as all_first_messages;
 count_correct | correct_groups | all_first_messages 
---------------+----------------+--------------------
 t             | t              | t
(1 row)

-- Purge queue to ensure it's empty for polling timeout test
SELECT * FROM pgmq.purge_queue('fifo_head_poll_queue');
 purge_queue 
-------------
           5
(1 row)

-- Validate polling waits and returns empty when the queue is empty
-- This test verifies the polling behavior when no messages are available
DO $$
DECLARE
    start_time TIMESTAMPTZ;
    end_time TIMESTAMPTZ;
    elapsed NUMERIC;
    result_count INTEGER;
BEGIN
    start_time := clock_timestamp();
    SELECT COUNT(*) INTO result_count
    FROM pgmq.read_grouped_head_with_poll('fifo_head_poll_queue', 10, 5, 1, 100);
    end_time := clock_timestamp();
    elapsed := EXTRACT(EPOCH FROM (end_time - start_time));

    IF result_count != 0 THEN
        RAISE EXCEPTION 'Expected 0 results from empty queue, got %', result_count;
    END IF;

    IF elapsed < 0.9 THEN
        RAISE EXCEPTION 'Polling completed too quickly (% seconds), expected ~1 second', elapsed;
    END IF;
END $$;
-- Cleanup
SELECT pgmq.drop_queue('fifo_head_poll_queue');
 drop_queue 
------------
 t
(1 row)

SELECT pgmq.drop_queue('fifo_test_queue');
 drop_queue 
------------
 t
(1 row)

